{
  "org_id": "CI-GOV-018",
  "wikidata_qid": "Q114787381",
  "basic_info": {
    "name_original": "Ministère des Mines, du Pétrole et de l'Énergie",
    "name_zh": "科特迪瓦矿业、石油与能源部",
    "name_en": "Ministry of Mines, Petroleum and Energy",
    "aliases": [
      "MMPE",
      "Ministère Mines, Pétroles et Energies",
      "Ministère des Mines, du Pétrole et de l'Energie",
      "Ministry of Mines, Oil and Energy"
    ],
    "org_type": "GOV",
    "org_subtype": "ministry",
    "country_iso3": "CIV",
    "hq_country_iso3": "CIV",
    "founded_date": null,
    "website": "https://www.energie.gouv.ci/"
  },
  "social_accounts": [
    {
      "platform": "facebook",
      "account_name": "mmpeciv",
      "url": "https://www.facebook.com/mmpeciv",
      "source": "官网 https://www.energie.gouv.ci/ 页脚社交链接"
    },
    {
      "platform": "twitter_x",
      "account_name": "@MMPE225",
      "url": "https://www.twitter.com/MMPE225",
      "source": "官网 https://www.energie.gouv.ci/ 页脚社交链接"
    },
    {
      "platform": "linkedin",
      "account_name": "Ministère des Mines, du Pétrole et de l'Énergie",
      "url": "https://www.linkedin.com/in/minist%C3%A8re-des-mines-du-p%C3%A9trole-et-de-l-energie-9ba548275/",
      "source": "官网 https://www.energie.gouv.ci/ 页脚社交链接"
    }
  ],
  "digital_assets": [
    {
      "name": "科特迪瓦矿业地籍平台（Cadastre minier）",
      "url": "https://portals.landfolio.com/CoteDIvoire/en/",
      "description": "官方矿业地籍电子管理平台，提供矿权区块、许可证查询服务",
      "source": "官网导航栏"
    },
    {
      "name": "SIREXE 国际矿产资源与能源展",
      "url": "https://sirexe.ci",
      "description": "科特迪瓦国际采掘业与能源沙龙（Salon International des Ressources Extractives et de l'Énergie）官方网站，2026年举办第二届并配套 SIREXE Hackathon 竞赛",
      "source": "官网导航栏及官网新闻"
    },
    {
      "name": "矿业与地质总司网站（DGMG）",
      "url": "http://mines.gouv.ci/",
      "description": "矿业与地质总司（Direction Générale des Mines et de la Géologie）官方网站",
      "source": "官网导航栏"
    },
    {
      "name": "碳氢化合物总司网站（DGH）",
      "url": "http://dgh.energie.gouv.ci/",
      "description": "碳氢化合物总司（Direction Générale des Hydrocarbures）官方网站",
      "source": "官网导航栏"
    },
    {
      "name": "能源总司网站（DGE）",
      "url": "https://www.dgenergie.ci/",
      "description": "能源总司（Direction Générale de l'Énergie）官方网站，发布PEPT、PRONER、FONAME等能源项目及电力与可再生能源法律法规",
      "source": "官网导航栏"
    }
  ],
  "key_people": [
    {
      "person_id": "CI-PERSON-000010",
      "name": "桑加弗瓦·庫里巴利 (Sangafowa Coulibaly)",
      "title": "部长 (Ministre des Mines, du Pétrole et de l'Énergie)",
      "title_description": "2026年1月23日总统府公报及第2026-08号法令任命其为Mambé II政府矿业、石油与能源部长（连任）；在2023年10月Mambé I政府及此前Achi政府中亦执掌该部",
      "description": "科特迪瓦资深政治人物，曾长期担任农业部长，后转任矿业、石油与能源部长；多次代表科特迪瓦出席国际能源与矿业活动，如访问阿尔及利亚石油学院（IAP）、主持SIREXE国际展会并在非洲矿产增值论坛上发声"
    }
  ],
  "departments": [
    {
      "dept_id": "CI-GOV-018-DEPT-001",
      "name": "部长办公厅 (Cabinet du Ministre)",
      "head": null,
      "description": "含办公厅主任、办公厅副主任、内阁办公厅长、10名技术顾问、8名研究专员、1名特派专员及私人秘书处等（依据部委组织法令）",
      "parent_dept_id": null
    },
    {
      "dept_id": "CI-GOV-018-DEPT-002",
      "name": "矿业与地质总司 (Direction Générale des Mines et de la Géologie, DGMG)",
      "head": null,
      "description": "主管矿业政策执行与地质调查，官方网站 mines.gouv.ci",
      "parent_dept_id": null
    },
    {
      "dept_id": "CI-GOV-018-DEPT-003",
      "name": "碳氢化合物总司 (Direction Générale des Hydrocarbures, DGH)",
      "head": null,
      "description": "主管油气勘探开发活动促进与成品油供应配送协调，官方网站 dgh.energie.gouv.ci",
      "parent_dept_id": null
    },
    {
      "dept_id": "CI-GOV-018-DEPT-004",
      "name": "能源总司 (Direction Générale de l'Énergie, DGE)",
      "head": null,
      "description": "主管国家能源政策统筹规划、电力与可再生能源立法监督，官方网站 dgenergie.ci，管理PEPT、PRONER、FONAME等能源项目",
      "parent_dept_id": null
    },
    {
      "dept_id": "CI-GOV-018-DEPT-005",
      "name": "部长直属司局（Directions et Services rattachés au Cabinet）",
      "head": null,
      "description": "包括总监察团（Inspection Générale）、财务事务司、人力资源司、规划与统计司、金伯利进程科特迪瓦代表处常设秘书处、矿业法违法打击旅（BRICM）、传播与文献处、信息处、公共采购处及资产管理处等",
      "parent_dept_id": null
    }
  ],
  "recent_events": [
    {
      "date": "2026-01-23",
      "title": "桑加弗瓦·库利巴利在Mambé II政府中留任矿业、石油与能源部长",
      "description": "总统瓦塔拉签署第2026-08号法令任命Mambé II政府（34名成员），马马杜·桑加弗瓦·库利巴利留任矿业、石油与能源部长；总统府公报与多家媒体（Abidjan.net、Africa-press、AIP等）均予确认",
      "impact": "能源与矿业政策保持连续性，Baleine三期开发与矿业增值战略得以延续推进",
      "source": "https://alerte-news.net/gouvernement-du-23-janvier-2026-voici-lequipe-mambe-2/"
    },
    {
      "date": "2026-02-16",
      "title": "矿业、石油与能源部宣布发现Calao South新油气田",
      "description": "该部与意大利埃尼公司（Eni）共同宣布：Eni与PETROCI合作在海上CI-501区块Murene South-1X井（井深超5000米）获得重大油气发现，命名为「Calao South」，储量估计约14亿桶油当量，含轻质油、天然气与凝析油",
      "impact": "继Baleine之后再现重大发现，巩固科特迪瓦作为西非新兴油气生产国的地位，为后续勘探开发提供新增长点（依据Eni新闻稿及Jeune Afrique等多家媒体、部官网新闻交叉确认）",
      "source": "https://www.eni.com/en-IT/media/press-release/2026/02/eni-announce-discovery-calao-channel-complex-murene-south-1x-block-c1-501-offshore-cote-ivoire.html"
    },
    {
      "date": "2026-05-25",
      "title": "Baleine油气田第三期开发作出最终投资决定（FID）",
      "description": "Eni、PETROCI与Vitol组成的联合体正式就Baleine油气田第三期（最后一期）开发作出最终投资决定，投资约40亿美元；投产后原油产量将从6万桶/日提升至15万桶/日，天然气产量从8000万立方英尺/日提升至2亿立方英尺/日（Eni新闻稿、路透社、部官网新闻交叉确认）",
      "impact": "为科特迪瓦2027-2028年油气产能大幅爬坡奠定基础，有望使其跻身西非主要油气生产国行列",
      "source": "https://www.reuters.com/business/energy/eni-partners-approve-new-development-phase-ivory-coast-project-2026-05-25/"
    },
    {
      "date": "2026-07-01",
      "title": "非洲石油生产国组织（APPO）第27次执行理事会会议在亚穆苏克罗举行",
      "description": "APPO第27次执行理事会例会在科特迪瓦亚穆苏克罗召开（据部官网新闻，2026年7月），本部承办相关会议事务",
      "impact": "体现科特迪瓦在非洲区域能源治理与合作中的参与度提升（日期仅确认到月）",
      "source": "https://www.energie.gouv.ci/actualite/yamoussoukro-27e-reunion-ordinaire-du-conseil-executif-de-lorganisation-des-producteurs-de-petrole-africains-appo-6a4a568711c39"
    },
    {
      "date": "2026-09-17",
      "title": "科特迪瓦与巴西国家石油公司（Petrobras）签署8份海上区块产品分成合同",
      "description": "科特迪瓦政府、PETROCI Holding与Petrobras在阿比让签署8份产品分成合同（CPP），覆盖西部沿岸逾3.4万平方公里的海上区块；Petrobras持各区块90%作业权益，PETROCI持10%并拥有15%附加权益的付费选择权，投资承诺超2500亿西非法郎，使国家沉积盆地勘探覆盖率达约75%（路透社、RFI、新华社法文版等多源确认）",
      "impact": "首次引入巴西国家石油公司进入科特迪瓦沉积盆地勘探，显著提升勘探覆盖率与潜在储量前景",
      "source": "https://www.reuters.com/business/energy/petrobras-signs-production-sharing-deals-ivory-coast-exploratory-blocks-2026-09-17/"
    }
  ],
  "related_entities": [
    {
      "org_id": "CI-GOV-002",
      "org_name": "科特迪瓦政府（部长会议） (Gouvernement de Côte d'Ivoire (Conseil des ministres))",
      "org_type": "GOV",
      "org_description": "科特迪瓦中央政府，现由总理罗贝尔·伯格雷·芒贝（Robert Beugré Mambé）主持，本部为其组成部门",
      "relationship_type": "parent_org"
    },
    {
      "org_id": "CI-SOE-001",
      "org_name": "科特迪瓦国家石油公司 (PETROCI Holding)",
      "org_type": "SOE",
      "org_description": "科特迪瓦国家石油公司，隶属本部监管，代表国家参与Baleine、Calao South等油气项目及与Petrobras的产品分成合同",
      "relationship_type": "subsidiary"
    },
    {
      "org_id": "CI-SOE-002",
      "org_name": "科特迪瓦国家矿业开发公司 (SODEMI (Société pour le Développement Minier de la Côte d'Ivoire))",
      "org_type": "SOE",
      "org_description": "国家矿业开发公司，隶属本部监管，从事矿产资源勘探开发",
      "relationship_type": "subsidiary"
    },
    {
      "org_id": "CI-SOE-003",
      "org_name": "科特迪瓦炼油公司 (Société ivoirienne de raffinage (SIR))",
      "org_type": "SOE",
      "org_description": "阿比让炼油厂运营企业，石油下游板块重点国有企业，属本部碳氢化合物板块监管范畴",
      "relationship_type": "subsidiary"
    },
    {
      "org_id": "CI-SOE-008",
      "org_name": "国家石油产品储运公司 (Gestoci)",
      "org_type": "SOE",
      "org_description": "国家石油产品储运企业，2026年其亚穆苏克罗油库启用2万立方米柴油储罐及全国首个源头装油站，由部长桑加弗瓦·库利巴利主持启用仪式",
      "relationship_type": "subsidiary"
    },
    {
      "org_id": "CI-CORP-013",
      "org_name": "科特迪瓦电力公司 (Compagnie ivoirienne d'électricité (CIE))",
      "org_type": "CORP",
      "org_description": "科特迪瓦电力生产、输送与配送特许经营运营商，属本部电力能源政策监管范畴的重点企业",
      "relationship_type": "affiliated"
    },
    {
      "org_id": "CI-CORP-013",
      "org_name": "科特迪瓦国家电力监管局 (Autorité Nationale de Régulation du secteur de l'Électricité de Côte d'Ivoire (ANARE-CI))",
      "org_type": "GOV",
      "org_description": "依据《电力法典》设立的国家独立电力监管机构，负责电力行业法律法规执行监督与消费者保护，其监管的电力行业属本部政策主管范畴",
      "relationship_type": "affiliated"
    }
  ],
  "core_business": "科特迪瓦矿业、石油与能源部（MMPE）是负责国家矿业、石油天然气与电力能源政策制定与执行的政府部门，办公地点位于阿比让高原区SCIAM大厦15层（BP V 50 Abidjan），联系邮箱info@energie.gouv.ci。在矿业方面，负责矿业法律法规与规章制定、矿产半成品与成品加工转化推进、矿产品质量标准管理与反欺诈，以及民用爆炸物品和承压设备使用的监管；在碳氢化合物方面，负责油气领域立法与监督、油气勘探开发活动促进、成品油供应与配送协调，以及上市石油天然气产品质量合格控制与反欺诈；在能源方面，负责国家能源政策的统筹与规划、电力及可再生能源法律法规的制定与监督、能源资源利用管理。依据组织法令，本部设有部长办公厅及总监察团、财务事务司、人力资源司、规划与统计司、金伯利进程常设秘书处、矿业法违法打击旅（BRICM）等直属机构，下辖矿业与地质总司（DGMG）、碳氢化合物总司（DGH）、能源总司（DGE）三大总司及中央司局与外省服务机构；其监管与联系的重要公共企业包括国家石油公司PETROCI、国家矿业开发公司SODEMI、炼油公司SIR、储运公司Gestoci及电力运营商CIE等。近年主导推动科特迪瓦油气业快速发展：Baleine巨型油气田分阶段投产，2026年5月第三期开发作出约40亿美元最终投资决定，2026年2月宣布Calao South重大发现，2026年9月与Petrobras签署8份勘探区块产品分成合同；矿业方面推动黄金增值链建设、打击非法采金并举办SIREXE国际采掘业与能源展。",
  "industries": [
    "public_administration"
  ],
  "apec_stance": "科特迪瓦不是APEC成员（APEC现有21个成员经济体，非洲国家均未加入）。本部实际参与的国际合作框架主要包括：非洲联盟（AU）框架下的非洲能源与矿业合作，西非国家经济共同体（ECOWAS）与西非经济货币联盟（UEMOA）区域电力市场一体化与能源贸易，非洲石油生产国组织（APPO，2026年7月其第27次执行理事会会议在科特迪瓦亚穆苏克罗举行），采掘业透明度倡议（ITIE，部官网设专栏），金伯利进程（Kimberley Process，部内设常设秘书处监管钻石原产地），以及与意大利埃尼（Eni）、巴西国家石油公司（Petrobras）、Vitol、SLB（斯伦贝谢）等国际能源企业的双边合作。禁止编造任何「加入APEC」或「主办APEC会议」的内容。",
  "profile": null,
  "collection_meta": {
    "collection_date": "2026-10-06",
    "phase": "phase3_enriched",
    "data_sources": [
      "wikidata",
      "official_website",
      "government_directory",
      "news_search"
    ],
    "quotes": [
      {
        "title": "Gouvernement du 23 janvier 2026 : voici l'équipe Mambé 2（Mambé II政府名单，确认矿能部长连任）",
        "url": "https://alerte-news.net/gouvernement-du-23-janvier-2026-voici-lequipe-mambe-2/"
      },
      {
        "title": "Missions et organisation — Ministère des Mines, du Pétrole et de l'Énergie（官网组织架构与职能页）",
        "url": "https://www.energie.gouv.ci/apropos/mission-organisation"
      },